{ "Domain": { "Space": { "Binary mesh": true},
              "Time": { "Integrator": "DTK::TimeIntegrate",
                        "Method": "LSRK14"}},
  "Field": { "Write weights": true},
  "Field Slice": [ { "Format": "float",
                     "Frequency": 1000,
                     "Lattice": [ [0.25, 0.0, 0.0],
                                  [0.0, 0.25, 0.0],
                                  [0.0, 0.0, 1.0]],
                     "Origin": [0.0, 0.0, 0.0],
                     "Outputs": [ { "Default": 0.0,
                                    "Field": "rE",
                                    "File": "rE"}],
                     "Verbosity": 1},
                   { "Format": "float",
                     "Frequency": 1000,
                     "Lattice": [ [0.125, 0.0, 0.0],
                                  [0.0, 100.0, 0.0],
                                  [0.0, 0.0, 0.125]],
                     "Origin": [0.0, 0.0, 0.0],
                     "Outputs": [ { "Default": 0.0,
                                    "Field": "ru",
                                    "File": "ru"}],
                     "Verbosity": 1}],
  "Title": "Turbulent channel flow",
  "Zoltan": { "Partition": { "algorithm": "hypergraph"}}}
